{
  "$schema": "./schemas/directory.schema.json",
  "enabled": false,
  "roles": [
    {
      "id": "core-team",
      "label": "Core Team"
    },
    {
      "id": "volunteer",
      "label": "Volunteers"
    },
    {
      "id": "ambassador",
      "label": "Ambassadors"
    },
    {
      "id": "speaker",
      "label": "Speakers"
    }
  ],
  "team": {
    "title": "DevFest Team",
    "lead": "Meet the people behind DevFest, across editions.",
    "undatedLabel": "Edition to confirm",
    "allRoles": "Everyone",
    "description": "The people bringing DevFest Indore together."
  },
  "talks": {
    "title": "Talks",
    "lead": "Explore talks and workshops from DevFest and the wider GDG Indore community.",
    "resourcesLabel": "Resources",
    "speakersLabel": "Speakers"
  },
  "partners": {
    "title": "Partners & communities",
    "lead": "Explore the organizations supporting DevFest and their contributions across editions.",
    "unknownYearLabel": "Past contributions",
    "ecosystemLabel": "Community ecosystem"
  },
  "filters": {
    "searchLabel": "Search",
    "searchPlaceholder": "Search names, roles or topics",
    "yearLabel": "Year",
    "allYears": "All editions",
    "typeLabel": "Contribution",
    "allTypes": "All contributions",
    "emptyTitle": "No matching records",
    "emptyText": "Try another edition or clear your search.",
    "clearLabel": "Clear filters",
    "trackLabel": "Track",
    "allTracks": "All tracks",
    "rolesLabel": "Team roles",
    "peopleSingular": "person",
    "peoplePlural": "people",
    "talkSingular": "talk",
    "talkPlural": "talks",
    "organizationSingular": "organization",
    "organizationPlural": "organizations",
    "sponsorsLabel": "Sponsors",
    "collaboratorsLabel": "Collaborators",
    "communitiesLabel": "Communities",
    "mediaLabel": "Media",
    "eventLabel": "Event",
    "allEvents": "All events"
  },
  "profile": {
    "historyTitle": "Event contributions",
    "talksTitle": "Talks",
    "workshopsTitle": "Campus workshops",
    "aboutTitle": "About",
    "linksTitle": "Public profiles",
    "backTeam": "DevFest Team",
    "backTalks": "All talks",
    "backPartners": "Partners & communities",
    "officialRecordLabel": "Official event record",
    "sourceLabel": "Source",
    "fallbackLead": "GDG Indore community",
    "reviewNotice": "Review preview · Profile details and edition assignments await organizer approval.",
    "communityTitle": "Other community appearances",
    "approvedReviewNotice": "Review preview · This profile is approved. Other profiles remain under review."
  }
}
